{
  "$schema": "../../../schema/middle-profile.schema.json",
  "collections": {
    "candidateLearningRelations": "learning-relations.candidate.json",
    "clusters": "clusters.json",
    "courses": "courses.json",
    "coverageGaps": "coverage-gaps.json",
    "domains": "domains.json",
    "learningRelations": "learning-relations.json",
    "reviewRecords": "review-records.json",
    "standards": "standards.json",
    "subjectGroups": "subject-groups.json",
    "topics": "topics.json"
  },
  "counts": {
    "candidateLearningRelations": 1988,
    "clusters": 149,
    "courses": 24,
    "coverageGaps": 2,
    "domains": 149,
    "learningRelations": 56,
    "reviewRecords": 1,
    "standards": 714,
    "subjectGroups": 13,
    "topics": 2160
  },
  "createdDate": "2026-07-13",
  "curriculumVersion": "2022-revised",
  "profile": "middle",
  "releaseId": "kr-2022-middle-v0.6.0-candidate",
  "rightsStatus": "cleared",
  "schoolLevel": "middle",
  "sourceManifest": "../shared/source-manifest.json",
  "status": "candidate",
  "textPolicy": {
    "officialTextIncluded": false,
    "summaryPolicy": "공식 성취기준 문장은 수록하지 않고 코드·locator와 기계적 초안 요약을 사용하며 전문가 검토 상태를 분리한다."
  }
}
